<?xml version="1.0" encoding="UTF-8"?>
<component-info xmlns="http://www.xtpxlib.nl/ns/webdoc" xmlns:xsi="http://www.w3.org/2001/XMLSchema-instance"
  xmlns:xml="http://www.w3.org/XML/1998/namespace" xsi:schemaLocation="http://www.xtpxlib.nl/ns/webdoc xsd/component-info.xsd" name="xtpxlib-webdoc">
  <!-- ================================================================== -->
  <!--
    Component information for this xtpxlib component.

    The information in this document is used in several places to generate documentation, readme files, etc.
  -->
  <!-- ================================================================== -->

  <releases>
    <release version="3.0" date="2024-12-12">
      Deprecation of XProc 1.0. Several fixes.
    </release>
    <release version="2.0.1" date="2023-07-19">
      Minor documentation updates.
    </release>
    <release version="2.0" date="2023-07-11">
      Added XProc 3.0 support.
    </release>
    <release version="1.2" date="2020-10-15">
      Generate release information on main doc page.
    </release>
    <release version="1.1" date="2020-02-16">
      New logo and minor text changes
    </release>
    <release version="1.0" date="2019-12-18">
      Initial release
    </release>
    <release version="0.9.A" date="2019-12-10">
      Pre-release of `xtpxlib-webdoc` (added GitHub pages details).
    </release>
    <release version="0.9" date="2019-12-10">
      Pre-release of `xtpxlib-webdoc` (mainly for testing procedures and the GitHub pages details).
    </release>
  </releases>

  <dependencies>
    <component name="xtpxlib-common"/>
    <component name="xtpxlib-container"/>
    <component name="xtpxlib-xdoc"/>
  </dependencies>

  <title>Common website + GitHub pages generator software</title>
  <summary>
    **`xtpxlib-webdoc`** is an *internal* component in the **`xtpxlib`** library. It takes care of:
        
    * The main **`xtpxlib`** documentation website.
    * Some internal scripts and documentation for publishing and releasing components.
  </summary>
  
  <documentation-uri>https://www.xtpxlib.org</documentation-uri>

  <git-uri>git@github.com:xatapult/xtpxlib-webdoc.git</git-uri>
  <git-site-uri>https://github.com/xatapult/xtpxlib-webdoc</git-site-uri>

</component-info>
